name,art,ability,slug
WidowSBite,https://marvelsnapzone.com/wp-content/themes/blocksy-child/assets/media/cards/widows-bite.webp?v=149,"While this is in your hand, you can't draw cards.",WidowSBite
WinterSoldier,https://marvelsnapzone.com/wp-content/themes/blocksy-child/assets/media/cards/winter-soldier.webp?v=149,No ability,WinterSoldier
Wolfsbane,https://marvelsnapzone.com/wp-content/themes/blocksy-child/assets/media/cards/wolfsbane.webp?v=149,On reveal: +2 power for each other card you have here.,Wolfsbane
Wolverine,https://marvelsnapzone.com/wp-content/themes/blocksy-child/assets/media/cards/wolverine.webp?v=149,"When this is discarded or destroyed, regenerate it with +2 power at a random location.",Wolverine
Wong,https://marvelsnapzone.com/wp-content/themes/blocksy-child/assets/media/cards/wong.webp?v=149,Ongoing: Your on reveal abilities here happen twice.,Wong
X23,https://marvelsnapzone.com/wp-content/themes/blocksy-child/assets/media/cards/x-23.webp?v=149,"When this is discarded or destroyed, regenerate it at a random location and you get +1 energy next turn.",X23
Yellowjacket,https://marvelsnapzone.com/wp-content/themes/blocksy-child/assets/media/cards/yellowjacket.webp?v=149,On reveal: Afflict your other cards here with -1 power.,Yellowjacket
Yondu,https://marvelsnapzone.com/wp-content/themes/blocksy-child/assets/media/cards/yondu.webp?v=149,On reveal: Destroy the top card of your opponent's deck.,Yondu
Zabu,https://marvelsnapzone.com/wp-content/themes/blocksy-child/assets/media/cards/zabu.webp?v=149,Ongoing: Your 4-cost cards cost 1 less. (minimum 1),Zabu
Zero,https://marvelsnapzone.com/wp-content/themes/blocksy-child/assets/media/cards/zero.webp?v=149,On reveal: Remove the abilities on the next card you play.,Zero
